{
  "schema_version": 1,
  "language": "en",
  "unit": "word",
  "text": "It is raining today",
  "segments": [
    {
      "text": "It is raining today",
      "timed_text_units": [
        { "text": "It", "start_ms": 0, "end_ms": 150 },
        { "text": "is", "start_ms": 150, "end_ms": 300 },
        { "text": "raining", "start_ms": 320, "end_ms": 800 },
        { "text": "today", "start_ms": 820, "end_ms": 1250 }
      ]
    }
  ]
}
